artist,genre,title,album,year,lyrics,Amazement,Calmness,Joyful activation,Nostalgia,Power,Sadness,Solemnity,Tenderness,Tension
Johnny Cash,Country,I’ve Been Everywhere,American II: Unchained,1996.0,"I’ve Been Everywhere. I was totin' my pack along the dusty Winnemucca road. When along came a semi with a high an' canvas covered load. ""If you're goin' to Winnemucca, Mack, with me you can ride"". And so I climbed into the cab and then I settled down inside. He asked me if I'd seen a road with so much dust and sand. And I said, ""Listen, I've traveled every road in this here land"". I've been everywhere, man. Crossed the desert's bare, man. I've breathed the mountain air, man. Of travel I've a'had my share, man. I've been everywhere. I've been to Reno, Chicago, Fargo, Minnesota. Buffalo, Toronto, Winslow, Sarasota. Wichita, Tulsa, Ottawa, Oklahoma. Tampa, Panama, Mattawa, La Paloma. Bangor, Baltimore, Salvador, Amarillo. Tocopilla, Barranquilla, and Padilla, I'm a killer. I've been to Boston, Charleston, Dayton, Louisiana. Washington, Houston, Kingston, Texarkana. Monterey, Faraday, Santa Fe, Tallapoosa. Glen Rock, Black Rock, Little Rock, Oskaloosa. Tennessee to Hennessey, Chicopee, Spirit Lake. Grand Lake, Devil's Lake, Crater Lake, for Pete's sake. I've been to Louisville, Nashville, Knoxville, Ombabika. Schefferville, Jacksonville, Waterville, Costa Rica. Pittsfield, Springfield, Bakersfield, Shreveport. Hackensack, Cadillac, Fond du Lac, Davenport. Idaho, Jellico, Argentina, Diamantina. Pasadena, Catalina, see what I mean'a. I've been to Pittsburgh, Parkersburg, Gravelbourg, Colorado. Ellensburg, Rexburg, Vicksburg, El Dorado. Larimore, Admore, Haverstraw, Chatanika. Chaska, Nebraska, Alaska, Opelaka. Baraboo, Waterloo, Kalamazoo, Kansas City. Sioux City, Cedar City, Dodge City, what a pity.",1,1,1,0,0,0,0,0,0
Pink Floyd,Rock,"Another Brick in the Wall, Pt. 2",The Wall,1979.0,"Another Brick in the Wall, Pt. 2. We don't need no education. We don't need no thought control. No dark sarcasm in the classroom. Teacher, leave them kids alone. Hey! Teacher! Leave them kids alone!. All in all, it's just another brick in the wall. All in all, you're just another brick in the wall. Teachers leave them kids alone. Leave us kids alone!. Wrong, do it again! *Children playing*. Wrong, do it again!. If you don't eat your meat, you can't have any pudding!. (Wrong, do it again!). How can you have any pudding if you don't eat your meat? You! Yes! You behind the bike sheds! Stand still, laddie!. (If you don't eat your meat, you can't have any pudding!. How can you have any pudding if you don't eat your meat?). (You! Stand still, laddie!). *Phone beeping sound*.",0,0,1,0,1,0,1,0,1
Shania Twain,Country,Up!,Up!,2003.0,"Up!. I'm goin' up (I'm goin' up). I'm goin' up. I'm goin' up, up, up, up. It's 'bout as bad as it could be. Seems everybody's buggin' me. Like nothing wants to go my way. Yeah, it just ain't been my day. Nothing's coming easily. Even my skin is acting weird. I wish that I could grow a beard. Then I could cover up my spots. Not play connect the dots. I just wanna disappear. Up, up, up. Can only go up from here. Where the clouds gonna clear. There's no way but up from here. Even something as simple as. Forgetting to fill up on gas. There ain't no explanation why. Things like that can make you cry. Just gotta learn to have a laugh. Oh. Yeah, yeah, yeah. Yeah, yeah, yeah, yeah, yeah. When everything is goin' wrong. Don't worry, it won't last for long. Yeah, it's all gonna come around. Don't go let it get you down. You gotta keep on holding on. It's about as bad as it could be (Bad as it could be). Seems everybody's bugging me (Everybody's bugging me). Oh, oh, oh, oh. And up, up, up. Up, up, up, ooh. Up, up, up, up, I'm goin' up (I'm goin' up). Ohh. Yeah, yeah, yeah yeah yeah.",0,0,0,0,1,1,1,0,1
The Mighty Diamonds,Reggae,Bodyguard,Deeper Roots Plus Dub,,"Bodyguard. Who's gonna bodyguard ya, mr. boduguard ? Who's gonna bodyguard ya, mr. bodyguard ? 'Cause I-man nuh wan' no one a mi yard. No one to claim seh dem a mi guard a mi yard. I want to know who. One of these days it a go dread (dreader than dread). Ev'ryone looking a place to hide 'em head, well dread. I wanna know who. Who's gonna bodyguard ya, mr. bodyguard, yeah. All who claim seh them a chief of staff. One a these days dem ha fi chuck off, yeah. Come a walk. I don't know who.",0,0,1,0,1,0,1,0,0
The Doors,Rock,Break On Through (To the Other Side),The Doors,1967.0,"Break On Through (To the Other Side). You know the day destroys the night. Night divides the day. Tried to run. Tried to hide. Break on through to the other side. Break on through to the other side, yeah. We chased our pleasures here. Dug our treasures there. But can't you still recall. The time we cried. Everybody loves my baby. She gets high. She gets high, yeah. I found an island in your arms. Country in your eyes. Arms that chain. Eyes that lie. Break on through oh, oh yeah. Made the scene. Week to week. Day to day. Hour to hour. The gate is strait. Deep and wide. Break on through. Yeah, yeah, yeah, yeah. Yeah.",0,0,0,1,0,1,0,1,1
Busta Rhymes,Hip-Hop,Arab Money,Back on My B.S.,2008.0,"Arab Money. Ron Browz, yes!. Oh, we back in the most amazin' way. Well, lemme introduce you to the new talk. Let's get straight to it. C'mon!. La ilaha illa Allah, ha la ili, hay yo. Hili b'Allah, hey, hili bay yo. We getting Arab money. Hala sheiki, ha lini falla. Mili ha lan shi inni mala. Now, there ain't no way that you could kill the beast dead. I got Middle East women and Middle East bread. I got oil well money in the desert playing golf. Dolce shorts, dashiki with a Louis Scarf. Chest cold, diamonds make a nigga wanna cough. In Dubai, 20 million on the villa loft. And then I step up in the club and then these other niggas mad as shit. The way I make the people wanna sing the hook in Arabic!. Seven star hotels, Maybach, movie sick. Big bitches, knock-kneed camel-toed groupie shit. Women walk around while security on camelback. Club on fire now, niggas don't know how to act. Sittin' in casinos while I'm gamblin' with Arafat. Money long, watch me purchase pieces of the Almanac. Y'all already know, I got the streets buzzin'. While I make you bow down and make Salaat like a Muslim. See, now I take trips to Baghdad dummy. While I use stacked chips and count Arab money now. I don't need to get fresh, about to grow a beard duke. So much cake even the money look weird too. Domestic bread, and I'm broad, I'm tryna eat right. Prince Al-Waleed bin Talal Al Saud. They respect the value of my worth in Mali, Malaysia. Iran and Iraq, Saudi Arabia!.",1,0,1,0,1,0,0,0,0
Kendrick Lamar,Hip-Hop,ELEMENT.,DAMN.,2017.0,"ELEMENT.. New Kung Fu Kenny. Ain't nobody prayin' for me. Y'all know, what happens on Earth stays on Earth. Here we go!. I don't give a fuck, I don't give a fuck. I don't give a, I don't give a, I don't give a fuck. I'm willin' to die for this shit. I done cried for this shit, might take a life for this shit. Put the Bible down and go eye for an eye for this shit. D-O-T my enemy, won't catch a vibe for this shit, ayy. I been stomped out in front of my mama. My daddy commissary made it to commas. Bitch, all my grandmas dead. So ain't nobody prayin' for me, I'm on your head, ayy. Thirty millions later, know the feds watchin'. Auntie on my Telegram like, ""Be cautious!"". I be hangin' out at Tam's, I be on Stockton. I don't do it for the 'Gram, I do it for Compton. I'm willin' to die for this shit, nigga. I'll take your fuckin' life for this shit, nigga. We ain't goin' back to broke, family sellin' dope. That's why you maney-ass rap niggas better know. If I gotta slap a pussy-ass nigga, I'ma make it look sexy. If I gotta go hard on a bitch, I'ma make it look sexy. I pull up, hop out, air out, made it look sexy. They won't take me out my element. Nah, take me out my element. I'm allergic to a bitch nigga, ayy. An imaginary rich nigga, ayy. Seven figures ho, that's slimmer than my bitch figure, ayy. Goin' digital and physical on all y'all, ayy. Bunch of criminals and money in my phone calls, ayy. We okay, we let the A1 fly. Relocate, jump on the same G5. Checkin' for me heavy 'cause I go yeah, I go yeah. They never been ready, yeah, I know yeah, know yeah. 100K spread across the floor, 'cross the floor, yeah. None of y'all fuckin' with the flow yeah, the flow yeah. Years in the makin', and don't y'all mistake it. I got 'em by a landslide, we talkin' about races. You know this'll never be a tie, just look at they laces. You know careers take off, just gotta be patient. Mr. One through Five, that's the only logic. Fake my death, go to Cuba, that's the only option. Damned if I do, if I don't (Yuh). Goddamn us all if you won't (Yuh). Damn, damn, damn, it's a goddamn shame. You ain't front in line, get out the goddamn way. Niggas thought they wasn't gonna see me, huh? Niggas thought that K-Dot real life. Was the same life they see on TV, huh? Niggas wanna flex on me and be in L.A. for free, huh? Next time they hit the 10 freeway, we need a receipt, huh? 'Cause most of y'all ain't real, most of y'all gon' squeal. Most of y'all just envy, but jealousy get you killed. Most of y'all throw rocks and try to hide your hand. Just say his name and I promise that you'll see Candyman. Because it's all in your eyes, most of y'all tell lies. Most of y'all don't fade, most of y'all been advised. Last LP I tried to lift the black artists. But it's a difference 'tween black artists and wack artists. It's the one and only, the world's greatest, the Kid Capri.",0,0,1,0,1,0,1,0,1
Lil Wayne,Hip-Hop,A Milli,Tha Carter III,2008.0,"A Milli. Bangladesh. Young Money!. You dig? Mack, I'm going in. A millionaire, I'm a Young Money millionaire. Tougher than Nigerian hair. My criteria compared to your career just isn't fair. I'm a venereal disease, like a menstrual bleed. Through the pencil, and leak on the sheet of the tablet in my mind. 'Cause I don't write shit, 'cause I ain't got time. 'Cause my seconds, minutes, hours go to the almighty dollar. And the almighty power of that ch-cha-cha-chopper. Sister, brother, son, daughter, father; mother-fuck a copper. Got the Maserati dancin' on the bridge, pussy poppin'. Tell the coppers: ""Ha-ha-ha-ha. You can't catch him, you can't stop him"". I go by them goon rules: if you can't beat 'em, then you pop 'em. You can't man 'em, then you mop 'em. You can't stand 'em, then you drop 'em. You pop 'em 'cause we pop 'em like Orville Redenbacher. Motherfucker, I'm ill. A million here, a million there. Sicilian bitch with long hair, with coke in her derriere. Like smoking the thinnest air. I open the Lamborghini, hopin' them crackers see me. Like, ""Look at that bastard Weezy!"". He's a beast, he's a dog, he's a mothafuckin' problem. Okay, you're a goon, but what's a goon to a goblin? Nothin', nothin', you ain't scarin' nothin'. On some faggot bullshit: call 'em Dennis Rodman. Call me what you want, bitch! Call me on my Sidekick!. Never answer when it's private, damn, I hate a shy bitch. Don't you hate a shy bitch? Yeah, I ate a shy bitch. She ain't shy no more, she changed her name to My Bitch. Yeah, nigga, that's my bitch, so when she ask. For the money when you through, don't be surprised, bitch!. And it ain't trickin' if you got it. But you like a bitch with no ass: You ain't got shit. Motherfucker, I'm ill, not sick. And I'm okay, but my watch sick, yeah, my drop sick. Yeah, my Glock sick, and my knot thick I'm it. Motherfucker, I'm ill. See, they say I'm rappin' like B.I.G., Jay, and 2Pac. Andre 3000, where is Erykah Badu at? Who that? Who that said they gon' beat Lil Wayne? My name ain't Bic, but I keep that flame, man. Who that one that do that, boy? You knew that true that, swallow. And I be the shit, now you got loose bowels. I don't owe you like two vowels. But I would like for you to pay me by the hour. And I'd rather be pushin' flowers. Than to be in the pen sharin' showers. Tony told us this world was ours. And the Bible told us every girl was sour. Don't play in her garden and don't smell her flower. Call me Mr. Carter or Mr. Lawn Mower. Boy, I got so many bitches, like I'm Mike Lowrey. Even Gwen Stefani said she couldn't doubt me. Motherfucker, I say ""Life ain't shit without me"". Chrome lips pokin' out the coupe, look like it's poutin'. I do what I do, and you do what you can do about it. Bitch, I can turn a crack rock into a mountain dare me. Don't you compare me, 'cause there ain't nobody near me. They don't see me but they hear me. They don't feel me but they fear me. I'm illy, C3, 3 Peat.",0,0,0,0,1,0,0,0,1
Martina McBride,Country,I Just Call You Mine,Shine,2009.0,I Just Call You Mine. I pinch myself. Sometimes to make sure I'm not in a dream. That's how it seems. I close my eyes and breathe in the sweetest moments I've ever known. It feels like home. And here I am. I want to be your everything. There you are. Turning winter into spring. And everyone that sees you. Always wants to know you. And everyone that knows you. Always has a smile. You're a standing ovation. After take years of waiting. For a chance to finally shine. Everyone calls you amazing. Yeah. I just call you mine. I fall apart. And just a word from you. Somehow seems to fix. Whatever's wrong. Oh. You reach into the weakest moments and remind me that I'm strong. You got to know. I'd be a fool not to see or even worse to forget. That you're more than I deserve. Nothing makes sense when you're not here. As if my whole world disappears. Without you what's the point of it.,1,0,0,0,0,0,0,1,0
Reba McEntire,Country,Tammy Wynette Kind of Pain,Stronger Than the Truth,2019.0,"Tammy Wynette Kind of Pain. This ain't a little mascara running down my cheek. And this ain't a little scratch that'll heal in a couple of weeks. This is more than a little smile I'm having to fake. 'Cause this ain't no little girl heartache. Standing by your man. That's a broken plan. When he breaks your heart and all your trust. With his two cheating hands. So it's D-I-V-O-R-C-E. And you don't want him to see you crying. So you're crying in the rain. And this is Tammy Wynette. We're talking Tammy Wynette kind of pain. There's a sky full of tears and every single note. And every single word is wine and whiskey-soaked. So I guess it's me and her, together in this all along. 'Til I can make it on my own. Well that's a broken plan. And it's D-I-V-O-R-C-E. Means this golden wedding ring. Don't mean a thing. Oh this is Tammy Wynette. This is Tammy Wynette.",0,0,0,1,0,1,0,0,1
The Beatles,Rock,Let It Be,Let It Be,1970.0,"Let It Be. When I find myself in times of trouble, Mother Mary comes to me. Speaking words of wisdom, ""let it be"". And in my hour of darkness, she is standing right in front of me. Let it be, let it be. Whisper words of wisdom. Let it be. And when the brokenhearted people living in the world agree. There will be an answer, let it be. For though they may be parted, there is still a chance that they will see. Yeah, there will be an answer. Let it be, yeah, let it be. And when the night is cloudy, there is still a light that shines on me. Shine on 'til tomorrow, let it be. I wake up to the sound of music, Mother Mary comes to me. Speaking words of wisdom, let it be. There will be an answer.",0,1,1,1,1,0,0,1,1
The Who,Rock,Tommy Can You Hear Me,Tommy,1969.0,"Tommy Can You Hear Me. Tommy, can you hear me? Can you feel me near you? Tommy, can you see me? Can I help to cheer you? Tommy, Tommy, Tommy..",0,1,0,0,0,1,0,1,1
​​blink-182,Rock,What’s My Age Again?,Enema of the State,1999.0,What’s My Age Again?. I took her out. It was a Friday night. I wore cologne. To get the feeling right. We started making out. And she took off my pants. But then I turned on the TV. And that's about the time she walked away from me. Nobody likes you when you're 23. And are still more amused by TV shows. What the hell is ADD? My friends say I should act my age. What's my age again? Then later on. On the drive home. I called her mom. From a payphone. I said I was the cops. And your husband's in jail. This state looks down on sodomy. And that's about the time that bitch hung up on me. And are still more amused by prank phone calls. What the hell is call ID? And you still act like you're in freshman year. What the hell is wrong with me? (What's my age again?) That's about the time that she broke up with me. (Please stay with me) No one should take themselves so seriously. (Please stay with me) With many years ahead to fall in line. (Please stay with me) Why would you wish that on me? (Please stay) I never wanna act my age. (With) What's my age again? (Me) What's my age again?,0,0,1,0,1,1,0,1,1
Rita Marley,Reggae,Get it Together,,,"Get it Together. Get it together Harambee. Get it together, get together. Help your brother Harambee. Help your Sister Harambee. Help you brother, help your sister help your brother Harambee. Tell the people Harambee. Tell the people, tell the people. Love one another Harambee. Love on another Harambee. Love one another, love one another.",0,1,0,0,0,0,1,1,0
Dolly Parton,Country,Dumb Blonde,"Hello, I’m Dolly",1967.0,"Dumb Blonde. Don't try to cry your way out of this. Don't try to lie or I'll catch you in it. Don't try to make me feel sorry for you. Just because I'm blonde. Don't think I'm dumb. Because this dumb blonde isn't nobody's fool. When you left you thought I'd sit. And you thought I'd wait. And you thought I'd cry. You called me a dumb blonde. Ah, but somehow I lived through it. And you know if there's one thing this blonde has learned. Blondes have more fun. You flew too high up off the ground. It's stormy wheater and had to come back down. But I've found new thread for my old spool. Because this dumb blonde is nobody's fool.",1,0,1,0,1,0,0,0,1
​​blink-182,Rock,First Date,Take Off Your Pants and Jacket,2001.0,"First Date. In the car, I just can't wait. To pick you up on our very first date. Is it cool if I hold your hand? Is it wrong if I think it's lame to dance? Do you like my stupid hair? Would you guess that I didn't know what to wear? I'm too scared of what you think. You make me nervous, so I really can't eat. Let's go, don't wait, this night's almost over. Honest, let's make this night last forever. Forever and ever, let's make this last forever. When you smile, I melt inside. I'm not worthy for a minute of your time. I really wish it was only me and you. I'm jealous of everybody in the room. Please don't look at me with those eyes. Please don't hint that you're capable of lies. I dread the thought of our very first kiss. A target that I'm probably gonna miss.",1,0,1,0,0,0,0,1,0
Luke Bryan,Country,Knockin’ Boots,,2019.0,"Knockin’ Boots. This truck needs a half tank. These wheels need a two-lane. This radio needs three songs to play. To get me 'cross town to you. That dress needs to slip off. That hair needs to come down. Friday nights need to do. What Friday nights need to do. That's the truth. Yeah, birds need bees and ice needs whiskey. Boys like me need girls like you to kiss me. ""Fishin' in the Dark"" needs Nitty Gritty. Under that pale moon. Sweet tea needs that sugar stirrin'. Small town nights need both ends burnin'. Shades need drawin', hearts need fallin'. Boots need knockin', knockin' boots. Knockin' boots, me and you, oh. Long weeks need a weekend. Cheap drinks need a-slingin'. That dance floor needs some me on you. And you on me tonight. Singalongs need to be sung. Tip bells need to be rung. Last calls need a call that cab. And backseats need I want you so bad. Boys like me need the girls like you to kiss me. Knockin' boots, girl, me and you. Doors need shuttin'. Lights need cuttin'. Lips need lockin'. Boots need knockin'. And birds need bees and ice needs whiskey. Mmm, knockin' boots, me and you, oh. Knockin' boots.",1,0,1,0,0,0,0,1,0
Pink Floyd,Rock,Mother,The Wall,1979.0,"Mother. Mother, do you think they'll drop the bomb? Mother, do you think they'll like this song? Mother, do you think they'll try to break my balls? Ooh-ah, mother, should I build the wall? Mother, should I run for president? Mother, should I trust the government? Mother, will they put me in the firing line? Ooh-ah, is it just a waste of time? Hush now, baby, baby, don't you cry. Mamma's gonna make all of your nightmares come true. Mamma's gonna put all of her fears into you. Mamma's gonna keep you right here, under her wing. She won't let you fly, but she might let you sing. Mamma's gonna keep baby cosy and warm. Ooooh, babe. Ooh, babe. Of course, Mamma's gonna help build the wall. Mother, do you think she's good enoughfor me? Mother, do you think she's dangerousto me? Mother, will she tear your little boy apart? Ooh-ah, mother, will she break my heart? Mamma's gonna check out all your girlfriends for you. Mamma won't let anyone dirty get through. Mamma's gonna wait up until you get in. Mamma will always find out where you've been. Mamma's gonna keep baby healthy and clean. You'll always be baby to me. Mother, did it need to be so high?",0,1,0,0,0,1,0,1,0
Creed,Rock,Weathered,Weathered,2001.0,"Weathered. I lie awake on a long dark night. I can't seem to tame my mind. Slings and arrows are killing me inside. Maybe I can't accept the life that's mine. No, maybe I can't accept the life that's mine. Simple living is my desperate cry. Been trading love with indifference. And, yeah, it suits me just fine. I try to hold on but I'm calloused to the bone. Maybe that's why I feel alone, yeah. Maybe that's why I feel so alone. Because me, I'm rusted and weathered. Barely holding together. I'm covered with skin that peels. And it just won't heal. I am rusted and weathered. No, it just won't heal, no, no, no. The sun shines and I can't avoid the light. I think I'm holding on to life too tight. Ashes to ashes and dust to dust. Sometimes I feel like giving up, yeah. I said, sometimes I feel like giving up. Barely holdin' together. It just won't heal, no. The day reminds me of you. The night hides your truth. The earth is a voice. Speaking to you. Take all this pride. And leave it behind. Because one day it ends. One day we die. Believe what you will. That is your right. But I choose to win. I choose to fight, to fight. Covered with skin that peels. And it just won't.",0,0,0,0,0,1,0,0,0
Burning Spear,Reggae,Not Guilty,,,"Not Guilty. The crime you want to charge. I-Man for, it's not possible. And I am not guilty. I've been following all these. Great foreigners footsteps. Foreigners like honorable. Marcus Mosiah Garvey. Mr. Malcom X. Martin Luther King. Its they who payed. The way for I and I. So therefore I and I. Could be recognized. Jah send them, Jah send them. Marcus Garvey was the first. Rastaman, from Jamaica. And Malcom X was the. American Rastaman. He was a Rastaman. They criticize the man's. Philosophy. But they sould remember, he. Set an example. The red, the black an green -. Marcus original. Some people want you to. Be ignorant, and lack off speech. And live in fear. I was only following all these. Great foreigners' footsteps, the. First voices of my people. Mr. and Ms jury, use your. Discretion, I am not guilty.",0,0,0,0,1,0,1,0,1
J. Cole,Hip-Hop,Love Yourz,2014 Forest Hills Drive,2014.0,"Love Yourz. Love yours. No such thing. No such thing as a life that's better than yours. No such thing as a life that's better than yours (Love yours). No such thing, no such thing. Heart beatin' fast, let a nigga know that he alive. Fake niggas, mad snakes. Snakes in the grass let a nigga know that he arrived. Don't be sleepin' on your level. 'Cause it's beauty in the struggle, nigga (Beauty, beauty). Goes for all y'all. It's beauty in the struggle, nigga (Beauty, beauty). Let me explain, yeah. It's beauty in the struggle, ugliness in the success. Hear my words or listen to my signal of distress. I grew up in the city and know sometimes we had less. Compared to some of my niggas. Down the block, man, we were blessed. And life can't be no fairytale, no once upon a time. But I be goddamned if a nigga don't be tryin'. So tell me, Momma please, why you be drinkin' all the time? Does all the pain he brought you still linger in your mind? 'Cause pain still lingers on mine. On the road to riches, listen, this is what you'll find. The good news is, nigga, you came a long way. The bad news is, nigga, you went the wrong way. Think being broke was better. (think being broke was better). For what's money without happiness? Or hard times without the people you love? Though I'm not sure what's 'bout to happen next. I ask for strength from the Lord up above. 'Cause I've been strong so far. But I can feel my grip loosenin'. Quick, do somethin' before you lose it for good. Get it back and use it for good. And touch the people how you did like before. I'm tired of livin' with demons 'cause they always invitin' more. Now I don't mean that phrase with no disrespect. To all my niggas out there livin' in debt. Cashin' minimal checks, turn on the TV see a nigga Rolex. And fantasize about a life with no stress. I mean this shit sincerely. And as a nigga who was once in your shoes. Livin' with nothin' to lose, I hope one day you hear me. Always gon' be a bigger house somewhere, but nigga feel me. Long as the people in that motherfucker love you dearly. Always gon' be a whip that's better than the one you got. Always gon' be some clothes that's fresher than the ones you rock. Always gon' be a bitch that's badder out there on the tours. But you ain't never gon' be happy 'til you love yours.",0,0,0,1,0,1,1,0,1
