artist,genre,title,album,year,lyrics,Amazement,Calmness,Joyful activation,Nostalgia,Power,Sadness,Solemnity,Tenderness,Tension
Stone Temple Pilots,Rock,Kitchenware & Candy Bars,Purple,1994.0,"Kitchenware & Candy Bars. Somebody told me, I know where to go. Somebody showed me, I was last to know. Sell me down the river. What I wanted, is what I wanted. What I wanted is what she wanted. Unfriendly feelings, down on wounded knees. Unfriendly reasons, some blind mother's need. What I wanted, is what we wanted. What we wanted is what she wanted. You read the words and it sells you life. They sell their words, but it's all a lie. What we wanted is what we wanted. What I wanted, is what I wanted, is. What we wanted, is what she wanted.",0,1,0,0,0,1,1,0,0
The Church,Rock,Almost With You,The Blurred Crusade,1982.0,Almost With You. See the chains which bind the men. Can you taste their lonely arrogance. It's always too late and your face is so cold. They struggled for this opulence. See the suns which blind the men. Burnt away so long before our time. Now their warmth is forgotten and gone. Pretty maids not far behind. Who you trying to get in touch with? I'm almost with you. I can sense it wait for me. Is this the taste of victory? See the dust which fills your sleep. Does it always feel this chill near the end. I never dreamed we'd meet here once more. This laugh reserved for a friend.,1,0,0,0,1,0,1,1,1
Coolio,Hip-Hop,Rollin’ With My Homies,Clueless (Original Motion Picture Soundtrack),,"Rollin’ With My Homies. Saturday morning, take the train for a ride. The sun is up, I got my homies by my side. Rollin' down the street with my sixteen speakers. Hittin' corners on the beach, daddy dippin'. I hang a light at the right, ready to have fun. Then I bust a left for the 121. Pull it into park and lay it on the grass. I roll back the ride, so I can see some ass. Clock one sista, fifteens in the rear. Bump a forty, leaves me gawkin' here. I hits 'em up for the circle, that's how I'm livin'. Crowbars in the house and gat is on a mission. You can be Blood, or you can see Crippin' fool. But I ain't trippin'. My homie Snoop kicks the gin and juice and that's alright. But a-Coolio with the flow seems to yak all night. Rollin' with my homies (sippin' we yak all night, yeah). Sippin' on yak all night (I got us on the way in the CPT, and it's alright). Yak all night. Rollin' with my homies (sippin' yak all night, yeah). Pumpin' up the keg and roll it in a paper. It's like a match, you light it up and pass it to your neighbour. Night time is the right time... a-DYNAMITE!!. We're gonna have a good time. I jump back in the wagon, lock up the ass. Pop in the tape and a match. West when I fly I take the exit on Crenshaw. And guess what I saw. Two fools at the light, they stared me up. But I just look 'em in the eye and I say, ""Wassup?"". And even though I really don't want no trouble. I got thirty-one replies to bust your bubble. I don't really wanna hurt nobody. So I keeps on rollin' on my way to the party. I just wanna kick it, yeah, that's the ticket. Pass me the cup so we can get twisted. I'm rollin with my homies, yeah. 'Said we'd yak all night, yeah yeah. I roll up to the party and I'm straight old bent. And 'catchin' me a freak was my intent. There's a whole pack o' rats' ass standin' in the front. So I drops the ass and let the sistas bump. Here comes one now, she's on the tip. She says she likes the way my woofers kick. But I don't fall in love with every girl I see. So I pass up two and go straight to three. She got a ass like the back of a bus, cuz. And that's why I say ""In Crips We Trust"". I let her hit my twenty, got straight to the point. Wassup? Do you wanna kick it or what? I ain't got time to be frontin', I ain't talkin' 'bout nuttin' Just a little sumpin' sumpin'. If you're fine and you won't front. I don't wanna be your man, but I'll hook you up. Yes I'm rollin' rollin' rollin'. Yes I'm rollin' with my homies. Rollin' with my homies... ooohhh..",0,0,1,0,0,0,0,0,1
Jimmy Cliff,Reggae,Born to win,"Oh, Jamaica",,"Born to win. I am born to win. Being lost and found, turned upside down, yeah, yeah. Yeah. Being cast aside and being despised, uhm, uhm, uhm. Like Daniel in the lion's den, and Johann in the bally. Of the whale. I'm not alone so I cannot fail, no, no, no. And I'm born to win. I am born to win;. Yes I'm born to win. I've been rejected, yet considered dead, yeah, yeah. I've been accused and been refused uhm, uhm, uhm. But the stone that the belly refused shall be the head. On the stones. I cannot fail 'cause I'm not all alone, no, no, no. Yes I'm born, born, born to win. I am born, born, born, born to win.",0,0,0,0,1,0,1,0,0
Tim McGraw,Country,Neon Church,TM18,2018.0,"Neon Church. I need Jesus or I need whiskey. Whatever works best to get me through. Gettin' over you. A little Friday night hallelujah. A congregation of backsliders just like me. Yeah, what I need. Is a neon church. With a jukebox choir. Full of honky tonk angels. With their wings on fire. Straight pourin' out that Johnnie Walker healin'. I got a feelin'. I need a neon church. Baptize me in that barroom smoke. Bartender, preach to me 'til my heart ain't broke no more. Ain't that what this place is for? I tried bended knee, hands-up prayin'. But damn did that hurt, don't just keep hangin' around. What I need right now. Just a-sippin' down that unholy water. Save that hurt-like-hell for tomorrow. I'll stay here all night. In a neon church. With the party crowd. Where the good times roll. And the music's loud. Instead of home starin' holes in the ceiling. I got a feeling.",0,0,1,0,0,1,0,0,0
Wu-Tang Clan,Hip-Hop,Impossible,Wu-Tang Forever,1997.0,"Impossible. Yo, check check it. You can never defeat. Yo, check the method of this shit right here one time. The Gods. Sparking your braincells to the upmost. Impossible. Unlimited epidemics being spreaded. You know, we try and add on for y'all niggas. Yo, yo. Fusion of the five elements, to search for the higher intelligence. Women walk around celibate, livin' irrelevant. The most benevolent king, communicatin' through your dreams. Mental pictures been painted, Allah's heard and seen. Everywhere, throughout your surrounding atmosphere. Troposphere, thermosphere, stratosphere. Can you imagine from one single idea, everything appeared here. Understanding makes my truth, crystal clear. Innocent black immigrants locked in housing tenements. Eighty-Five percent tenants depended welfare recipients. Stapleton's been stamped as a concentration camp. At night I walk through, third eye as bright as a street lamp. Electric microbes, robotic probes. Taking telescope pictures of globe, babies getting pierced with microchips. Stuffed inside their earlobes, then examinated. Blood contaminated, vaccinated, lives fabricated. Exaggerated authorization, Food and Drug Administration. Testing poison in prison population. My occupation to stop the inauguration of Satan. Some claim that it was Reagan, so I come to slay men. Like Bartholomew, 'cause every particle is physical article. Was diabolical to the last visible molecule. A spaceknight like Rom, consume planets like Unicron. Blasting photon bombs from the arm like Galvatron. United Nations, gun bias style patient. Formulating rap plural a capella occupation. Conquer land like Napoleon, military bomb fest. We want sanitary food, planetary conquest. Thug peoples on some hardco' body shit. Get your shit together 'fore the fuck Illuminati hit. Dreams is free and escape is sleep. For a fool peep jewels, keep tools for tough time. The rule of rough mind, elevate, stay behind. The sun gotta shine, keep on, cremate. The whole Babylon, times up, move on. Kings on your pawn, checkmate, no fakes. Supposed through the gate, case closed. Things get froze, when it comes time, chosen ones. Will holding guns, we take flight with no fright. And attack, never fear cause our words is clear. What's been done can't be undone Son, we can't care. Cause the last days and times are surely here. Snakes and flakes get blown, by the righteous ones. Divine minds bind, we unified as one. Half of black folk, we half broke, smoke a bowl of weed shit. Our everlasting essence stay flying over Egypt. For you to defeat, the Gods. Impossible, you can never defeat. The gods. Call an ambulance, Jamie been shot, word to Kimmy. Don't go son, nigga you my motherfucking heart. Stay still son, don't move, just think about Keeba. She'll be three in January, your young God needs ya. The ambulance is taking too long. Everybody get the fuck back, excuse me bitch, gimme your jack. One, seven one eight, nine one one, low battery, damn. Blood comin out his mouth, he bleedin badly. Nahhh Jamie, don't start that shit. Keep your head up, if you escape hell we gettin fucked up. When we was eight, we went to Bat Day to see the Yanks. In Sixty-Nine, his father and mines, they robbed banks. He pointed to the charm on his neck. With his last bit of energy left, told me rock it with respect. I opened it, seen the God holdin his kids. Photogenic, tears just burst out my wig. Plus he dropped one, oh shit, here come his Old Earth. With no shoes on, screamin holdin her breasts with a gown on. She fell and then lightly touched his jaw, kissed him. Rubbed his hair, turned around the ambulance was there. Plus the blue coats, Officer Lough, took it as a joke. Weeks ago he strip-searched the God and gave him back his coke. Bitches yellin, Beenie Man swung on Helen. In the back of a cop car, Dirty Tasha are tellin. But suddenly a chill came through it was weird. Felt like my man, was cast out my heaven now we share. Laid on the stretcher, blood on his Wally's like ketchup. Deep like the Paul assassination with a sketch of it. It can't be, from Yoo-hoo to Lee's. Second grade humped the teachers, about to leave. Finally this closed chapter, comes to an end. He was announced, pronounced dead, y'all, at twelve ten. Now what my man is trying to tell y'all. Is that across the whole globe. The murder rates is increasin, and we decreasing. So at the same time, when you play with guns. When you play with guns, son. That causes the conflict of you going against your own. You hear me, so let's pay attention. Straight up and down, cause this is only a story. From the real.",0,0,0,0,1,1,1,0,1
Manic Street Preachers,Rock,Of Walking Abortion,The Holy Bible,1994.0,"Of Walking Abortion. I knew that someday I was gonna die. And I knew before I died. Two things would happen to me. That number one, I would regret my entire life. And number two, I would want to live my life over again. Life is lead weights, pendulum died. Pure or lost, spectator or crucified. Recognised truth acedia's blackest hole. Junkies, winos, whores; the nation's moral suicide. Loser, liar. Fake or phoney? No one cares. Everyone is guilty. Fucked up, don't know why, you poor little boy. We are all of walking abortions. Shalom shalom we all love our children. We all are of walking abortions. Shalom shalom there are no horizons. Mussolini hangs from a butcher's hook. Hitler reprised in the worm of your soul. Horthy's corpse screened to a million. Tiso revived, the horror of a bullfight. Fragments of uniforms, open black ruins. A moral conscience - you've no wounds to show. So wash your car in your 'X' baseball shoes. Little people in little houses. Like maggots small blind and worthless. The massacred innocent blood stains us all. Who's responsible - you fucking are. Who's responsible.",0,0,0,0,0,1,1,0,1
Placebo,Rock,Post Blue,Meds,2006.0,"Post Blue. It's in the water, baby. It's in the pills that bring you down. It's in your bag of golden brown. It's in your frequency. It's between you and me. It's in the pills that pick you up. It's in the special way we fuck. It's in your family tree. Bite the hand that feeds. Tap the vein that bleeds. Down on my bended knees. I break the back of love for you, I break the back of love for you. I break the back of love for you.",1,0,1,0,0,0,0,1,1
Lauryn Hill,Hip-Hop,Can’t Take My Eyes Off of You,The Miseducation of Lauryn Hill,1998.0,"Can’t Take My Eyes Off of You. You're just too good to be true. Can't take my eyes off of you. You'd be like heaven to touch (heaven to touch). I wanna hold you so much (hold you so much). At long last, love has arrived. And I thank God I'm alive. Pardon the way that I stare (the way that I stare). There's nothing else to compare. The sight of you leaves me weak. There are no words left to speak (words left to speak). But if you feel like I feel. Please, let me know that it's real. I need you, baby, and if it's quite all right. I need you, baby, to warm a lonely night. I love you, baby, trust in me when I say, ""It's okay"". Oh, pretty baby, don't let me down, I pray. Oh, pretty baby, now that I found you, stay. And let me love you, oh, babylet me love you, oh, baby. Can't take my eyes off of you (eyes off of you). You'd be like heaven to touch.",1,0,0,0,0,1,0,1,0
The Cure,Rock,The Lovecats,Japanese Whispers,1983.0,"The Lovecats. We move like cagey tigers. We couldn't get closer than this. The way we walk, the way we talk. The way we stalk, the way we kiss. We slip through the streets while everyone sleeps. Getting bigger and sleeker, and wider and brighter. We bite and scratch and scream all night. Let's go and throw all the songs we know. Into the sea, you and me. All the years and no one heard. I'll show you in spring, it's a treacherous thing. We missed you hissed the lovecats. We're so wonderfully, wonderfully. Wonderfully, wonderfully pretty. Oh, you know that I'd do anything for you. We should have each other to tea, huh? We should have each other with cream? Then curl up in the fire. And sleep for awhile. It's the grooviest thing. It's the perfect dream. We should have each other to dinner, huh? Get up for awhile. Hand in hand is the only way to land. And always the right way round. Not broken in pieces, like hated little meeces. How could we miss someone as dumb as this? I love you, let's go. Oh, solid gold. How could we miss. Someone as dumb as this?",0,1,0,1,0,0,0,1,0
Dr. Dre,Hip-Hop,What’s the Difference,2001,1999.0,"What’s the Difference. What's the difference between me and you? Back when Cube was rollin' with Lorenzo in a Benzo. I was bangin' with a gang of instrumentals. Got the pens and pencils, got down to business. But sometimes the business end of this shit. Can turn your friends against you. But you was a real nigga, I could sense it in you. I still remember the window of the car that you went through. That's fucked up, but I'll never forget the shit we been through. And I'ma do whatever it takes to convince you. 'Cause you my nigga, Doc, and Eazy, I'm still with you. Fuck the beef, nigga, I miss you. And that's just being real with you. You see the truth is. Everybody wanna know how close me and Snoop is. And who I'm still cool with. Then I got these fake-ass niggas I first blew with. Claimin' that they non-violent, talkin' like they. (Do not resist the beat). Spit venom in interviews, speakin' on reunions. Move units, then talk shit and we can do this. Until then, I ain't even speakin' your name. Just keep my name outta your mouth. And we can keep it the same, nigga. It ain't that I'm too big to listen to the rumors. It's just that I'm too damn big to pay attention to 'em. That's the difference. You talk a good one, but you don't do what you supposed to do. I act on what I feel and never deal with emotions. I'm used to livin' big dog style and straight coastin'. Yo, I stay with it, while you try to perpetrate and play with it. Never knew about the next level until Dre did it. I stay committed while you motherfuckers babysitted. I smash you critics like a overhand right from Riddick. Come and get it, shitted on villains by the millions. I be catchin' bitches while bitches be catchin' feelings. So what the fuck am I supposed to do? I pop bottles and hot hollow-points at each and all of you. A heartless bastard, high and plastered. My style is like the reaction from too much acid. Never come down, pass it around if you can't handle it. Hang Hollywood niggas by they Soul Train laminates. (What?). About five bank accounts, three ounces, and two vehicles. Until my death, I'm Bangladesh. I suggest you hold yo' breath 'til ain't none left. Yo, that's the difference!. A'ight, hold up, hold up!. Stop the beat a minute, I got somethin' to say, Dre. I wanna tell you this shit right now. While this fuckin' weed is in me (What the fuck?). I don't know if I ever told you this. But I love you, dog, I got your motherfuckin' back. (Right) Just know this shit. Slim, I don't know if you noticed it. But I've had your back from day one,. Nigga, let's blow this bitch. I mean it dog, you ever need somebody offed:. ""Whose throat is it?"". Well if you ever kill that Kim bitch. I'll show you where the ocean is. Well, that's cool, and I appreciate the offer. But if I do decide to really murder my daughter's momma. I'ma sit her up in the front seat and put sunglasses on her. And cruise around with her for seven hours through California. And have her wavin' at people (Hi!). Then drop her off on the corner at the police station. And drive off honkin' the horn for her. Raw dawg, get your arm gnawed off. Drop the sawed off. And beat you with the piece it was sawed off of. Fuck blood, I wanna see some lungs coughed up. Get shot up in the hot tub 'til the bubbles pop up. In they nose and cough snot up, mucus in hot water. That's for tryin' to talk like The Chronic was lost product. That's for even thinkin' of havin' them thoughts thought up. You better show some respect whenever the Doc's brought up. So what's the difference between us? We can start at the penis. Or we can scream ""I just don't give a fuck"" and see who means it. What's the difference between me and-- *Gunshot*.",0,0,0,1,1,0,0,1,0
Catatonia,Rock,My Selfish Gene,International Velvet,,"My Selfish Gene. You, me and destiny. Guess that it was never meant to be. All you did was give me allergy. I'm not looking for your sympathy. I am courted by uncertainty. Lost my will to live unselfishly. Altruism stinks of fallacy. My selfish gene. It fills my spleen with bile. And all the while. I thought you gave a damn. All you needed was some courtesy. And im not waitingfor an apology. Way back then i thought yo gave a damn.",0,0,0,1,0,1,0,0,1
Johnny Cash,Country,You Are My Sunshine,Unearthed 3: Redemption Songs,2003.0,"You Are My Sunshine. The other night dear, as I lay sleeping. I dreamed I held you in my arms. When I awoke, dear, I was mistaken. So I bowed my head and I cried. You are my sunshine, my only sunshine. You make me happy when skies are gray. You'll never know, dear, how much I love you. Please don't take my sunshine away. I've always loved you and made you happy. And nothing else could come between. But now you've left me to love another. You have shattered all of my dreams.",1,0,0,1,0,1,0,1,0
JAY-Z,Hip-Hop,Oceans,Magna Carta... Holy Grail,2013.0,"Oceans. (You see this motherfucking face). Blessings, blessings, yeah, I see... Elephant tusk on the bow of a sailing lady, docked on the Ivory Coast. Mercedes in a row winding down the road. I hope my black skin don't dirt this white tuxedo before the Basquiat show. And if so, well fuck it, fuck it. Because this water drown my family, this water mixed my blood. This water tells my story, this water knows it all. Go ahead and spill some champagne in the water. Go ahead and watch the sun blaze on the waves of the ocean. Dope boy still smelling like cocaina. White boat, white robe, can he be more cleaner? The oil spill that BP ain't clean up. I'm anti-Santa Maria. Only Christopher we acknowledge is Wallace. I don't even like Washingtons in my pocket. Black card go hard when I'm shopping. Boat docked in front of Hermes picking cotton. Silk and fleeces, lay on my Jesus. Oh my God, I hope y'all don't get seasick. See me in shit you never saw. If it wasn't for these pictures they wouldn't see me at all. Aww, whole world's in awe. I crash through glass ceilings, I break through closed doors. I'm on the ocean, I'm in heaven. Yachting, Ocean 11. Me and Ty Ty is like Pablo and Popeye. Winding dirt roads on mopeds spilling Opus. Welcome to the magnum opus, the Magna Carta. The best-selling author Decoded. On the holiday playin' ""Strange Fruit"". If I'ma make it to a billi, I can't take the same route. Swoosh, that's the sound of the border. Swoosh, and that's the sound of a baller. Muhammad Hovi my back against the rope. The black Maybach, I'm back inside the boat. Shepard Fairey they finally gave me some hope. Can't believe they got a nigga to vote. Democrat? Nope, I sold dope. In trouble waters I had to learn how to float. On the ocean, I'm in heaven.",1,0,0,0,1,1,0,0,0
Loretta Lynn,Country,Coal Miner’s Daughter,Coal Miner’s Daughter,1970.0,"Coal Miner’s Daughter. Well I was born the coal miner's daughter. In a cabin, on a hill in Butcher Holler. We were poor but we had love. That's the one thing that daddy made sure of. He shoveled coal to make a poor man's dollar. My daddy worked all night in the Van Lear coal mine. All day long in the field hauling corn. Mommy rocked the babies at night. And read the Bible by the coal oil light. And everything would start all over come break of morn. Daddy loved and raised eight kids on a miner's pay. Mommy scrubbed our clothes on a washboard everyday. Why I've seen her fingers bleed, to complain there was no need. She's smiled in mommy's understanding way. In the summertime we didn't have shoes to wear. But in the wintertime we'd all get a brand new pair. From a mail order catalog, money made from selling a hog. Daddy always managed to get the money somewhere. Yeah, I'm proud to be a coal miner's daughter. I remember well the well where I drew water. The work we done was hard. At night we'd sleep 'cause we were tired. I never thought of ever leaving Butcher Holler. Well a lot of things have changed since the way back then. And it's so good to be back home again. Not much left but the floor nothing lives here anymore. Except the memories of a coal miner's daughter.",1,1,1,1,0,0,0,1,0
50 Cent,Hip-Hop,Ghetto Qu’ran (Forgive Me),Power of the Dollar,,"Ghetto Qu’ran (Forgive Me). Uh huh, uh huh, uh huh. Southside, what y'all niggas know about the dirty South? One time. Lord forgive me, for I've sinned. Over and over again just to stay on top. I recall memories, filled with sin. Over and over again. And again and again and again. When you hear talk of the Southside, you hear talk of the Team. See, niggas feared Prince and respected Preme. For all you slow motherfuckers, I'ma break it down iller. See, Preme was the business man and Prince was the killer. Remember, he used to push the bulletproof BM, uh huh. His hair'll get you seasick, I sat back and peeped shit. The roll with E-Z Wider and they ain't get blunted. Had the whole projects working for 50 on 500. As a youth, all I ever did was sell crack. I used to idolize Cat. Hurt me in my heart to hear that nigga snitched on Pap. How he go out like that? Rumors in the hood was Just was snitching. I ain't believe that, pa, he helped me cop my first GSXR. Had the 4-runner, the Z, the 5 and the 3. Used to drive his truck through the hood dragging jet skis. From Gerald Wallace to Baby Wise, don't be surprised. Of how freely I throw out names of guys who dealt with pies. Like LA and Wise, L got shot in the neck, then told his connect. Them niggas who shot them got 'em for ten bricks. Fucking Dominicans, turned around and gave 'em more bricks. That first verse is just a dose of the shit that I'm on. Consider this the first chapter in the ghetto's Qu'ran. I know a lot of niggas that get dough like Bimmy and Joe. And Prince and Righteous from Hillside with the mole on his nose. Throughout my struggles in the hood, I started learning. Life's a bitch with a pretty face, but she burning. Man I'm a get cheese like Chaz then run through whips like Cigar. Gamble all the time like country-curly head Prince and Tah-Tah. Po-po under pressure too, they know what they facing. Go against crews like Bebo and killers like Pappy Mason. A lot of niggas I know been corrupted since birth. Enticed to rob nuns for fun, for everything they worth. I know some cats that held down whole complexes like Corley Wall. Together niggas stand and divided they fall. Round here, shook niggas they keep it in motion. Come around here with your Rollie, you can get robbed like Ocean. Lord knows, Tommy had Laurelton sold. Helicopters, Rolls Royces with Louis Vuitton interior. Might sound like I'm fantasizing, but son I'm dead serious. Montana was no dummy, brought business to wash the money. Had money out the ass, he politic like the Asian. Feds couldn't catch him dirty, so settled for tax evasion. Rest in peace to Rich and Ron, money what they was about, yo. The twins was from Queens but got crazy cream with Alpo. Throughout my time I heard tales of Himey, Frenchy. Jamaican Pauly, Duckie Corley. Ronnie Bumps and Chick... shit. A lot a niggas flow the way I flow. But ain't been in the game all their life so don't know who I know. Writing rhymes is the best way I express how I feel. If I ain't rich by twenty-six, I'll be dead or in jail. Coming up I heard sipping too much booze'll leave you confused. And if you watch the news you see players in this game that lose. I'm forgetting Lefty and Jazz, Pretty Tony and Lance. Head Lou, Mel son, Troy and E Money Bags. In a conversation over shrimp and lobster. At Benihana's, heard Chico stopped boxing, and started robbing diners. Shout out to Clarence and Clutch, Bob Dre, Black Will. If the flow don't kill you the MAC will.",0,1,0,1,1,1,0,0,1
